{
  "$schema": "http://json-schema.org/draft-07/schema#",
  "title": "Episode Journal",
  "type": "object",
  "description": "Audit and replay journal for runtime episodes. This is not durable memory.",
  "required": [
    "schema_version",
    "episode_id",
    "task_id",
    "runtime_manifest",
    "steps",
    "state_hashes",
    "evidence_refs",
    "verifier_output_refs",
    "commit_status",
    "rollback_status",
    "memory_write_effects"
  ],
  "properties": {
    "schema_version": {
      "type": "string"
    },
    "episode_id": {
      "type": "string",
      "description": "Stable identifier for this runtime episode."
    },
    "task_id": {
      "type": "string",
      "description": "Benchmark task identifier this episode belongs to."
    },
    "runtime_manifest": {
      "type": "object",
      "description": "Runtime, tool, environment, and schema version metadata needed for audit and replay."
    },
    "steps": {
      "type": "array",
      "description": "Execution and audit step records. This is not canonical state or durable memory.",
      "items": {
        "type": "object"
      }
    },
    "state_hashes": {
      "type": "array",
      "description": "Ordered accepted Canonical State hash sequence. The Episode Journal stores the sequence but is not part of Canonical State hash input.",
      "items": {
        "type": "string"
      }
    },
    "evidence_refs": {
      "type": "array",
      "items": {
        "type": "string"
      }
    },
    "verifier_output_refs": {
      "type": "array",
      "items": {
        "type": "string"
      }
    },
    "commit_status": {
      "type": "string",
      "enum": [
        "not_started",
        "pending_verification",
        "committed",
        "aborted",
        "rejected",
        "reconciled",
        "escalated"
      ],
      "description": "Episode or commit-group status after verifier and commit-controller handling."
    },
    "rollback_status": {
      "type": "string",
      "enum": [
        "not_applicable",
        "available",
        "completed",
        "failed",
        "unavailable",
        "compensation_required",
        "compensation_completed",
        "irreversible_escalation"
      ],
      "description": "Rollback or compensation status. Rollback is only available for reversible changes."
    },
    "memory_write_effects": {
      "type": "array",
      "description": "Audit references to memory-write effects. This is not the durable memory store and not learning.",
      "items": {
        "type": "object"
      }
    }
  },
  "additionalProperties": false
}
